<!ELEMENT competicions (competicio+)>
<!ELEMENT competicio (name,date,image,description)>
<!ELEMENT name (#PCDATA)>
<!ELEMENT date (#PCDATA)>
<!ELEMENT image (#PCDATA)>
<!ELEMENT description (#PCDATA)>
